"title","content","date","variant","images","verified","author","rating","product","url"
"5.0 out of 5 stars Exceptional Precision and Speed with a Sleek Charging Solution","The Razer Viper Ultimate Wireless Gaming Mouse has exceeded all my expectations. Its lightweight design makes it incredibly easy to maneuver, providing lightning fast response times with Razer’s Hyper speed wireless technology. As a gamer, I appreciate the precise accuracy and the customizable DPI settings, which allow for perfect control in any situation. The included RGB charging dock is not only stylish but also incredibly convenient. It keeps the mouse charged and ready to go, with the added bonus of customizable lighting that syncs beautifully with the rest of my setup. The battery life is impressive, lasting through extended gaming sessions without needing a recharge. Overall, this mouse offers everything a serious gamer needs speed, precision, and a hassle-free wireless experience.","26 Aug 2024","Color: Mercury White Style: Mouse + Dock","","Yes","DANE","5.0","Unknown Product","https://www.amazon.com/Razer-Ultimate-Lightweight-Wireless-Charging/product-reviews/B09TG6KG2T/ref=cm_cr_dp_d_show_all_btm?ie=UTF8&reviewerType=all_reviews"
"5.0 out of 5 stars Elevating My Competitive Edge in Warzone: A Razer Viper Ultimate Review","As a daily Call of Duty Warzone player and a competitive gamer, finding the right peripherals that match my high standards and intense gameplay requirements is crucial. The Razer Viper Ultimate Hyperspeed Lightweight Wireless Gaming Mouse, with its RGB Charging Dock, has not only met but exceeded my expectations, becoming a pivotal tool in my gaming arsenal. Precision and Responsiveness: In the fast-paced, high-stakes environment of Warzone, every millisecond counts. The Viper Ultimate's 20K DPI optical sensor and the fastest gaming mouse switches have provided me with the precision and responsiveness I need to make split-second decisions and execute them flawlessly. The optical switches are a standout, ensuring that every click is registered instantly without any latency, a critical factor in competitive gaming where every action can be the difference between victory and defeat. Ergonomics and Comfort: For someone who spends hours daily on Warzone, the design and comfort of a mouse are paramount. The Viper Ultimate's lightweight design and ambidextrous shape have been ideal for my hand size, offering a perfect balance between comfort and control. The mouse's dimensions allow for easy maneuverability without causing fatigue, making it suitable for extended gaming sessions. This balance is particularly beneficial in a game like Warzone, where quick movements and endurance are key. Wireless Performance and Battery Life: Initially, I was skeptical about switching to a wireless mouse for competitive gaming. However, the Viper Ultimate has dispelled all my doubts with its hyperspeed wireless connectivity, which has been as reliable and fast as a wired connection. The 70-hour battery life ensures that I'm never left hanging in the middle of a match, and the convenient RGB charging dock not only keeps my mouse charged but also adds a stylish flair to my gaming setup. Customization and Software: Tailoring the mouse to fit my gaming style has been a breeze with Razer Synapse. Disabling the ambidextrous side buttons to avoid accidental presses during intense Warzone matches was simple, and adjusting the DPI settings to match my gameplay has given me an edge over my competitors. The ability to store profiles directly on the mouse is a bonus, allowing me to maintain my settings regardless of where I'm playing. Overall Experience: Transitioning to the Razer Viper Ultimate has been a game-changer for my competitive play in Call of Duty Warzone. Its impeccable performance, combined with the lightweight design and reliable wireless connectivity, has not just enhanced my gameplay but also my overall gaming experience. The Viper Ultimate's size and shape have proved to be the ideal fit for me, striking the perfect balance between speed, precision, and comfort. In closing, the Razer Viper Ultimate has solidified its place as an indispensable part of my competitive gaming setup. It offers the high performance, durability, and comfort that I, as a competitive Warzone player, require. This mouse has not only met my rigorous demands but has also contributed to elevating my gameplay to new heights. For any serious gamer looking to enhance their performance in Call of Duty Warzone or any other competitive title, I cannot recommend the Razer Viper Ultimate enough.","04 Mar 2024","Color: Classic Black Style: Mouse + Dock","https://m.media-amazon.com/images/I/61tf2GvGbRL._SY88.jpg","Yes","Irakli T.","5.0","Unknown Product","https://www.amazon.com/Razer-Ultimate-Lightweight-Wireless-Charging/product-reviews/B09TG6KG2T/ref=cm_cr_dp_d_show_all_btm?ie=UTF8&reviewerType=all_reviews"
"5.0 out of 5 stars The First Razer Product I Like!","I have purchased Razer mice in the past and have never liked the way they felt in my hand.  This mouse however, feels great and I love it.  I bought this to replace my Glorious Model O mouse because I wanted to go wireless.  It's amazing that this wireless mouse is only about 6 grams heavier than the Model O and it doesn't even need to have the hexagonal pattern on the case to remove weight. I spend a lot of time in first-person shooters like Rainbow Six Siege and Battlefield when I'm not at my desktop doing normal daily web browsing and email reading. Here are some pros: - Feels very light, especially for a wireless mouse. - I don't sense any delay, even after I leave it sitting for a while. - It's very convenient to have a power button on the bottom of the mouse, and to have a charging dock to sit it on when not in use. - The button clicks are very satisfying - good sound, good force needed (not too much or too little for my taste). - Lighting is tasteful and not too overdone. - The finish on the mouse is nice to the touch - grippy on the sides, and smoothly textured elsewhere. - The side buttons are well-placed for my thumb.  Others have been a little too far forward for me. - The battery life seems great. I am part-way through my fifth day of use and the battery is at 51%.  I have been using it to play games every day for at least 3-5 hours per night plus regular Desktop duties for at least an hour each day as well.  I have not recharged it yet and I turn off the power at the end of each day when I am done with the mouse for the night. - The Synapse software is much better than I expected and has not crashed for me once.  It's pretty easy to understand and laid out fairly well.  It's great that it will change profiles for me automatically based on the games I start up, then go back to my ""desktop"" profile after I close the game. Here are some cons (for mouse, and Synapse software): - I miss the extra button on top of the mouse that my Model O had.  I wish this mouse had that extra button near the scroll wheel.  I have had to use one of the right-side buttons instead.  Although the right-side buttons are not as easy to press for me (since I'm a right-handed user) I'm getting used to them for desktop use. - I find the lighting options a bit confusing with regards to the ""Quick"" effects and the ""Advanced"" effects in the Synapse software.  Mostly, it's frustrating that only the Quick effects are stored on the mouse with the profiles and not the Advanced effects.  I think this means that if you want to use any of the Advanced effects, they will not be saved on the mouse and I'm not sure if they can be tied to games like the other profiles.  Before I can really fault the mouse or software for this one, I suppose I need to learn how to use it more.  Either way, I wish it were a little simpler to understand for first-time Synapse users like me. - I wish the mouse feet were ""slipperier"".  Compared to my Model O mouse, this mouse does not move across my cloth mouse mat as easily.  My no means is it ""not"" slippery, but it was noticeably less slippery when I was swapping them out.  Now that I have not used my Model O for about 5 days, I don't notice it any more or have any issues moving the mouse, but it would be nice to know that it was at least as free to move as the Model O.  This might turn into a plus as I get used to it because it may give me a little more ""control"". To summarize, I love this mouse!  It's been great to use so far and I'm very glad I switched back to this wireless option.  Lot's to like here and the software (despite some shortcomings) is much better than I expected and seems mostly mature and works well.","09 Aug 2020","Color: Classic Black Style: Mouse + Dock","","Yes","Jason","5.0","Unknown Product","https://www.amazon.com/Razer-Ultimate-Lightweight-Wireless-Charging/product-reviews/B09TG6KG2T/ref=cm_cr_dp_d_show_all_btm?ie=UTF8&reviewerType=all_reviews"
"5.0 out of 5 stars Comfortable Mouse","I use this as my everyday mouse, I don’t do PC gaming, but am aware of RAZER in the industry and its reputation for quality. This mouse is great. It is lightweight and the battery last a really long time and it conserves power when not in use, I’ve left it on and off the charger for 2 days straight and it still had enough juice to last the rest of the next day. The dock is really nice and I like that it recognizes the dongle in the dock so it only takes up one USB slot for the entire assembly. I also enjoy the LED light show that both the dock and mouse display when in use.","25 Jun 2024","Color: Classic Black Style: Mouse + Dock","https://m.media-amazon.com/images/I/619k3m4nYnL._SY88.jpg","Yes","Matt","5.0","Unknown Product","https://www.amazon.com/Razer-Ultimate-Lightweight-Wireless-Charging/product-reviews/B09TG6KG2T/ref=cm_cr_dp_d_show_all_btm?ie=UTF8&reviewerType=all_reviews"
"4.0 out of 5 stars Great mouse, one caveat! - Updated","I’ve purchased many Razer products, and from my experience with Razer, every single product I had had some sort of fatal problem eventually, with normal use. I decided to give them one last chance because I do love their Synapse program where you have control over everything, and they are actually stylish and relatively good quality products. This Wireless Viper Ultimate is lightweight, very responsive, and has very low delay. It feels good in the hand, and the left and right clicks need just the perfect force to click. Some of their other mice give you the option to change the force needed to click, so given that this one doesn’t, they have it set in a sweets spot. One thing I love about the mouse is that the USB receiver can be plugged directly into the charging dock, so you don’t need 2 USB slots on your computer I/O for the charging dock, and the USB receiver. The mouse is white, so I’m not sure if it will get discolored and rub off with time. It feels good in the hand, but I have one (avoidable) issue, and that is this mouse is made for both hands, it’s symmetrical, meaning that the side buttons are on the left, and the right side. I noticed that specially while gaming, it’s so easy to click one of the 2 side buttons by mistake with your pinky or ring finger. My solution was to disable them from Razer Synapse, but it would have been nice to still have those extra buttons put in a way where both left handed and right handed people can use them without making unintentional clicks. The other minor thing is that the sensitivity adjustment button is located under the mouse, and no longer behind the scroll wheel like all their other mice, meaning you can not control the sensitivity on the go while playing an FPS game for example, you’d have to flip it around and cycle through them one by one. It does have an LED indicator to let you know which sensitivity you’re on though. They are determined in Razer Synapse. Battery life is OK, holds a charge for a couple of days with heavy use. Overall, good mouse right out the box. I will be happy if this one holds better than the previous ones. Still rooting for Razer! UPDATE: Dropped to 4 stars. Months into using this mouse, and as expected, an issue magically appears as with most Razer products! The mouse will not charge when placed on the dock if the mouse goes below 5%. If it's not low in battery and you attempt to charge it it works just fine. I'm not sure if that's a software bug, but it's definitely annoying having to go back and forth between wired and wireless. You naturally charge the mouse when you get prompted that it's low in battery, but by that time it's too late.","08 Jan 2024","Color: Mercury White Style: Mouse + Dock","https://m.media-amazon.com/images/I/61sHjj0E8fL._SY88.jpg
https://m.media-amazon.com/images/I/71P-PHJs57L._SY88.jpg
https://m.media-amazon.com/images/I/71rJdkHGldL._SY88.jpg","Yes","Saif A.","4.0","Unknown Product","https://www.amazon.com/Razer-Ultimate-Lightweight-Wireless-Charging/product-reviews/B09TG6KG2T/ref=cm_cr_dp_d_show_all_btm?ie=UTF8&reviewerType=all_reviews"
"5.0 out of 5 stars Unleashing Gaming Excellence","he Razer Viper Ultimate Hyperspeed Wireless Gaming Mouse, paired with its RGB Charging Dock, has undoubtedly raised the bar for my gaming experience. As an avid gamer, I've been on the hunt for a mouse that combines precision, speed, and wireless convenience, and Razer has delivered all that and more. The first thing that caught my attention was the mouse's lightweight design. It's incredibly comfortable to hold, and the ambidextrous shape ensures a perfect fit for both left and right-handed gamers. The smooth, matte texture provides a secure grip, and I never experience hand fatigue even during marathon gaming sessions. The Hyperspeed wireless technology is a game-changer! The mouse boasts an almost imperceptible 1ms response time, which translates into instantaneous and lag-free movements. Gone are the days of being tethered by a cable – the wireless freedom enhances my gameplay and gives me a competitive edge. The Razer Viper Ultimate's optical sensor is nothing short of exceptional. With a DPI range of up to 20,000, I can customize the sensitivity to suit any gaming scenario. Whether I'm sniping from afar or engaging in fast-paced action, the mouse's accuracy ensures every movement is smooth and precise. The dedicated DPI clutch is a brilliant addition. By holding it, I can temporarily lower the DPI for those precise shots, making it a lifesaver in intense gaming situations. The RGB lighting is not just for aesthetics; it's customizable to indicate the battery level, which is incredibly convenient. Speaking of which, the battery life is outstanding. The Viper Ultimate lasts for hours of continuous gaming, and when it's time to recharge, the included RGB Charging Dock makes it effortless and looks fantastic on my gaming setup. The programmable buttons are easily configurable through Razer Synapse, providing endless customization options. Creating and saving profiles for different games or genres has never been simpler. In addition to its gaming prowess, the Razer Viper Ultimate is versatile enough for everyday use. The precision and responsiveness carry over to everyday tasks, making it a reliable companion for work and productivity. In conclusion, the Razer Viper Ultimate Hyperspeed Wireless Gaming Mouse, along with the RGB Charging Dock, has exceeded my expectations in every aspect. Its lightweight design, hyperspeed wireless technology, and customizable features make it the ultimate gaming mouse. I couldn't be happier with my purchase from Amazon, and I highly recommend the Razer Viper Ultimate to any serious gamer seeking a top-tier gaming mouse that delivers on every promise.","19 Jul 2023","Color: Classic Black Style: Mouse + Dock","","Yes","Amazon Customer","5.0","Unknown Product","https://www.amazon.com/Razer-Ultimate-Lightweight-Wireless-Charging/product-reviews/B09TG6KG2T/ref=cm_cr_dp_d_show_all_btm?ie=UTF8&reviewerType=all_reviews"
"5.0 out of 5 stars Viper Ultimate WINS vs. Logitech G903","I've owned both, and wanted to share some insights that I would have liked to have known before laying down this kind of cash for a mouse: Right off the bat, I need to say that the G903 is an excellent mouse but has a massive, fatal flaw: Logitech refuses to source an alternative to the frequently defective switches in its primary buttons.  If you google 'G903 double click issues,' you will find that these switches fail at an alarming rate.  This happened to me, after around 14mos for the original, 10mos. for the replacement under warranty.  Logitech refused to replace the replacement.  I consider this failure rate completely unacceptable for a ""premium"" mouse. My last mouse is 5+ years old and still going strong; I'm only switching because I wanted to go wireless. Personally, I will likely not trust Logitech for some time.  If you're willing to take the risk, see below for a comparison. Performance Both of these mice are incredibly responsive.  I would be hard pressed to tell the difference between wired and wireless modes on either mouse.  Both sensors are excellent and perform well on all surfaces.  Both of the mice have 5 steps of mouse sensitivity that can be individually modified by the user in the mouse software.  I love this.  The G903 has two dedicated buttons on the top of the mouse to move up and down between these sensitivity steps, which is much more convenient than the Viper's single button located on the underside of the mouse.  I assigned one of the Viper's side buttons for this, but it's not as convenient. Ergonomics: Both of these mice are ambidextrous.  (I'm left handed.)  The G903's larger size and rounder shape is probably best suited for a palm grip, but I use a claw grip and was totally fine.  The main thing is the G903 is a large mouse.  People with smaller hands will likely find this mouse cumbersome.  I slightly prefer the G903's side buttons, which protrude further than the Viper's which makes them a little easier to click, but this will be very subjective.  The Viper is a little flatter, a little narrower, and a little shorter, and the form factor a little better for my medium sized hands. It's also a lot lighter. The G903 does have customizable weights, although I don't really see the necessity of this. Battery Life: The Viper is rated to have a much longer battery life than the G903, but I found myself charging both of these mice every 3-5 days or so, depending on computer use.  The Viper does have the option to come with a dock, which I find convenient.  However, the USB connection, though standard, is hidden in an extremely narrow cutout that most generic cables will not fit in.  The G903 has a mousepad that lets you charge as you play, which is a cool idea, but it's expensive and really, as long as a mouse lasts a full day it's not that hard to charge at night. Wow, that was a long review.  Never done one that long before.  I just spent a ton of time researching and a ton of money buying these two mice, so thought I'd try to share some of that.","03 Apr 2020","Color: Classic Black Style: Mouse + Dock","","Yes","Y Marcus","5.0","Unknown Product","https://www.amazon.com/Razer-Ultimate-Lightweight-Wireless-Charging/product-reviews/B09TG6KG2T/ref=cm_cr_dp_d_show_all_btm?ie=UTF8&reviewerType=all_reviews"
"5.0 out of 5 stars Razer is really stepping up their mouse game","I wanted to try different mice after using a Logitech G502 lightspeed for a long time. While my G502 lightspeed is by no means a terrible mouse, I wanted something that weighed less and I wanted to try out different mice shapes. After hearing many praises for the Viper Ultimate, I decided to try it out myself to see if the hype was worth it or if it was all marketing nonsense. First off this is an ambidextrous mouse. I am a right handed user  and I mainly play with palm/claw grip sometimes transitioning to full palm and full claw grip. The rubber texturing on the sides and its shape makes it super comfortable to use and I have medium sized hands. On top of that, it is really lightweight. The charging dock is an absolute genius idea I wish other big companies would start adopting. You simply plug the dock into your PC, then plug the receiver on the spare usb port on the dock, and when you need to charge your mouse just put it on the dock. If you need to charge it in a pinch, take the usb cable out of the dock and plug it directly into the mouse. Next let's talk about build quality. And boy did Razer deliver. No signs of creaks, has a really solid feel, materials don't feel cheap, and the left/right clicks have really nice texturing on them. Left and right clicks may feel a little off at first if you are coming from mice that have extremely tactile and distinct clicks. That's because they are using optical switches and you may or may not like how they feel but I got used to them pretty quickly. The side buttons however have a really nice tactile feel and despite being an ambidextrous mouse, as a right handed user I never accidently bumped into the side buttons on the right hand side of the mouse. Razer really nailed the side button positioning such that they can't be accidently activated (at least in my opinion). Wireless performance is on par with my G502 lightspeed. No noticeable delays, weird connectivity issues, or any funny business. Battery life is also really good. I usually disable RGB and that really helps with battery life. Sadly I've only had my mouse for a few days so I can't fully test battery life claims. TLDR: An awesome mouse that won't disappoint. I recommend getting the dock combo to get the full experience. I mean, might as well if you're going to drop big money on a wireless mice anyways. I see no reason not to.","20 Jan 2021","Color: Classic Black Style: Mouse + Dock","https://images-na.ssl-images-amazon.com/images/I/81gWuiOHu0L._SY88.jpg
https://images-na.ssl-images-amazon.com/images/I/910v+LBnUKL._SY88.jpg
https://images-na.ssl-images-amazon.com/images/I/91DILJ+7GLL._SY88.jpg
https://images-na.ssl-images-amazon.com/images/I/91Iqu-ccgCL._SY88.jpg
https://images-na.ssl-images-amazon.com/images/I/91WE558MyZL._SY88.jpg","Yes","Kevin","5.0","Unknown Product","https://www.amazon.com/Razer-Ultimate-Lightweight-Wireless-Charging/product-reviews/B09TG6KG2T/ref=cm_cr_dp_d_show_all_btm?ie=UTF8&reviewerType=all_reviews"
